,year,pol,sentences,ocr,loss_distilbert,loss_hmd_distilbert,loss_bnert-time-st-y,loss_bnert-time-y,loss_bnert-time-y_masked_25,loss_bnert-time-y_masked_75
715,1856,lib,"brother, that the Go-vernor had faithfully and properly discharged the dutiesof his office, and that the charges brought against himwere both false and calumnious. (Hear, hear.)Mr. Alderman SIDNEY said he had read the evidence,and quite agreed wit h the opinion at which the visitingmactistrates had arrived. As he had been the means ofcommunicating': the rumour to the Court, he desired tosay that he bad done so on the statement of an officer veryhigh in confidence of the Court. It appeared that therumour had originated with the prisoner King himself,who stated in the infirmary that he bat been enabled towrite to",0.9327,66.57559252471731,4.267088683198578,4.410984196645942,4.443269443847169,4.398074011300325,4.403049726565588
716,1824,none,"effect was to increasethe difficulties of emigration, but not to prevent it, forit was known that mechanics in great numbers foundtheir way out of the country. They who recognised theprinciple of emigration by assisting persons to go to Ca-nada, the Cape of Good Hope, and other places, shouldnot surely refuse to the artisan the opportunity of con-verting his time and talents to the best advantage. Noman would willingly leave his native country unless hesaw a prospect of converting his knowledge and talentsto greater profit than he could at home. The secondobject he had in view, the exportation of machinery,v..asnne which",0.9719,55.54284437203082,4.239712411764367,4.2680420496526335,4.226529537684632,3.8813875590445326,3.873879235900086
717,1826,none,"short distance on the Skipton coach, when de-scending he fell with some violence on the ground, andthough medical assistance was had recourse to, he diedon the following morning.Public cm iosity was excited yesterday by the progressthe workmen have made in the preceding week at HydePark-corner. The foundation is laid for the Grand Tri-umphal Arch, so long talked of; and it consists ofimmense blocks of Portland stone and granite.The young Countess Bobrinsky, daughter of PrinceGortschakoff,and grand daughter of Ps i.ice Dolgorucky,descended from a house which once reigned in theUktaine, lately died whilst travelling in Prussia, at theearly age of nineteen. She",0.8559,117.2153467537364,7.098439616729875,6.835610079140324,6.77000329454303,7.033434459865267,7.007513009494544
718,1850,lib,"ttig ohFrenoh Beans, 3s to 4s per half sieve; Cabbage .14e. i Perditto; Mint, 9d to 15 per dozen bunches; Prt.tst_fb 0;9,1 to Is per ditto; Potatoes,6s par sieve; Turnips, 26 6 I to 3561 per dozen.I!,iiiiv, 0,per score; White Cos Lettuces, 9d to lob% roCarrots, 3s to Ss per dozen bunjhes o;Turnie •li.r. 3 itto2s 6d to 4s per cwt; ditto, is 6d to 33 per bushel;, :: gdBeans, is 6d to 2s Od per sieve; 6000, 8100 rs derper ditto; Shallots, 6d to 8d per lb; Onions, 2d Gel IV,bunch; Vegetable Marrow, Cd to Is'3dperdozett; hat eh;10d to",0.5138,227.0976792402675,23.85766503379449,23.569547097570332,23.548882323304426,23.485098411023657,23.540894257652536
719,1848,lib,"tu WP tips.the& they ma be eat OM mad metedlato the Herbarium.A pat -Maw order for la. 10d. will doable Jams Matthews I. andPlies 31,4kmoSsthes. sott.detkTHE TREE WMIL—ProoIOW lautrudiono torJ. Is ""casabas soCcloMps IMIMId IS SG wesisio.tom Or Gatilsort Costest: sift MMlhosi sollor Wl=esi Or sonueset••••• Viell. MINI( Mao MOW 1 MOMS • 11.1••••of cisme most d trots les thersold tondoPemba tut Mow hu ; los prom forMin up ~hes the pumasItsiSso loathItLiSsimit :dim PailaCet TZIa.to oa 1 I ~..k MNS Mimi setame d es Se arsup,:peepi=dltmtteik.hSok gwasps*.St peemodst Or. letstmd of11; 41%.71 esi lameIhrm. led Mk.= a me MMus;4",0.3346,1527.4917264438125,316.486575932247,296.9568453294957,295.2091414277622,294.31395840407504,295.12328623502094
720,1864,lib,"POLITICAL ECONOMY,Tho Professor of Political Economy will commence acourse of lectures on Tuesday, Oct. 25, on ""The EconomicPosition and Prospects of tho British Labourer."" Theselectures will be delivered in the LAW Schools on Tuesdays,Thursdays, and Saturdays, between 12 and 1. Gentlemenwho wish to obtain the professor's certificate will be requiredto attend these lectures. The examination for the certa.cate will take place on Jan. 30, 1865.ANNIVERSARY OF THE BATTLE OFF CAMPER-DOWN.—This day being the 67th anniversary ofthe ever-memorable battle off Camperdown, we subjoin thenames of the only six veteran survivors who live to com-memorate the glories of that day, together with",0.9574,34.326217276610734,3.7152988207756885,3.795742134766985,3.722334710792713,3.749354710081685,3.7337063848311804
721,1849,lib,"which was held on Tuesday, and itwas then immediately admitted that in the overcrowdedstate of this ground it would be quite impossible tocomply with the regulations, and that the order was infact a virtual closing of the churchyard for interments.One individual only was disposed to "" fight the Board ofHealth;"" but such a suggestion found no seconder, andit was unanimously resolved that the churchwardensshould immediately have the ground covered withquicklime as ordered, and that no more inter-ments should take place, and the rectors and church-wardens were requested, by a vote of the vestry,to make such piovition for interments as shouldbe",0.9535,50.47036043585409,5.2898648832671755,5.503982892833015,5.485853221128017,5.343192553988413,5.346862693051036
722,1835,lib,"SURREY SESSIONS.Thomas and George Barton, two brothers, were indictedfor stealing a pig, the property of Thomas Fox, a farmer atMottingham, in Kent.Both prisoners received excellent characters up to theperiod of this accusation. They were found guilty, but in:consequence of a recommendation to mercy by the prose-cutor, they (the prisoners) were sentenced to six months:imprisonment.After the trial of some unimportant cases the Sessionsterminated, when the following list of sentences of the pri-soners tried and convicted was rccorded :—For sheep-steal-.ing—transportation for life., ; ditto for seven years, 5 ;committed to Guildford and Brixton for six months each, 8..There were also sev-eral other",0.9292,71.5015838124347,3.8687838296916857,3.9190489834146023,3.9186098521965405,3.9268634595213183,3.934058472297929
723,1843,con,"days, contihued to wear a fiat appearance for all articlesexcept Wheat, which was rather more firm, some few parcelshaving been taken by country millers, and for Irish account,with little variation in any respect from the general currency ofour last circular.Scarcely more than two or three country buyers appeared atthis day's market, but of local dealers there was a moderate at-tendance, and to these a few thousand bushels of English oldand foreign free Wheats were disposed of for immediate con-sumption, chiefly in limited parcels ; and in some cases, but notgenerally, a decline of Id to :d per bulb was conceded,",0.9076,102.10968832697009,6.101304947394514,6.065766662520974,6.067331643539798,6.05126931402763,6.050167164845752
724,1821,con,"of Par-liamentary Reformers on.the 4th of April, which was publishedin several of the newspapers of the Wowing day, a liberty is takenwith my name, as little justifiable (in my judgment) by differencesof political opinion, as it is reconcileable with the ordinarycourtesies of private life.** The obvious meaning of that passage in your letter of whichI complain, is, to impute to me, that in upholding the presentsystem of reprisentation in the I louse of Commons, I am actuatedby the corrupt and dishonourable motive of a personal pecuniaryinterest."" It cannot be a matter of surprise to you, that I should feelmyself under",0.8395,95.49245337733939,6.402026556469708,6.004615304114313,5.952199327042698,6.009966188729437,6.059999102306805
725,1870,lib,"here, and I have no doubt that one ofthe striking characteristics of the approaching strugglewill be the sudden and unprepared nature of the factswhich will shed joy or sorrow over either land as Frenchdash or Prussian endurance bears away the palm ofvictory,FROM D CSSELDORF. —Great excitement prevails inthis usually quiet, not to say dull, town. Preparations forthe approaching struggle are going on at a great pace.Men are coming in by thousands, horses by hundreds.The English residents are doubtful whether they shalldiscreetly "" slope off "" at once, or valorously wait a littlelonger, and see what a few weeks may bring",0.9804,100.62882538058518,11.488531397239978,11.482036137866656,11.475829096473998,11.448413833365343,11.484582323727501
726,1857,lib,"of the night prevented anything thatapproached being seen until within 40 or 50 yardsdistance. About midnight, two large junks, which hadbeen well prepared, crammed with fern, faggots, andall kinds of inflammable materials, well saturatedwith oil and besprinkled with gunpowder, were sailedup Elliott Passage towards the Fatshan Creek—astrong breeze and flood-tide in their favour. TheComm! was here moored head and stern in the mainbranch of the river, one broadside commanding ElliotPassage, the other Fatshan Creek. The guard-boat,which had just left the ship, observed them, and im-mediately bailed ; finding no answer, she opened fire,which was quickly followed by the ship, and",0.965,70.86765970491976,6.853586035714896,6.609966946592406,6.571318583261828,6.400200524713455,6.435545142054411
727,1857,lib,"Thursday, at4 o'clock (Rev. J. B. Owen, Chairman), to conduct the business,when any subscriber may attend, if so disposed, the Board being, atall times desirous of receiving suggestions or giving explanation.The hospital is not endowed, hut is wholly dependent on volun-tary contributions and legacies, which are received by the Treasurer.John Masterman, Esq., M.P., Nicholas-lane ; also by Messrs. Couttsand Co.; Drummond and Co.; Berries and Co.; Ransom and Co. ;Prescott, Grote, and Barclay mith, Payne, and Co.; Glyn and Co. ;Jones Loyd and Co.; and Co.; Denison and Co.; Williams,De n, and CO.; Overend, Gurney, and Co. ;Nisbet and Co.,",0.8159,33.88633795016499,2.965226089592536,3.078492638077291,3.0682835687353216,2.98373255981021,2.9732305270749233
728,1845,lib,"him to order._quiry. —( Great laughter). The Honourable and Learned ( Hear, hear.) It did not appear to me that the lenguage.it ember fer Bath d, d. not condescend to answer these in- used by the lion. and Learned Gentleman in the debate onquirks. Ido riot call an question his motives for 1,01 doing- Friday night teas unparliamentary, and therefore I did not callso. I tam here. Sir.. in the hands of tale Hoag, and I bow him to order. No Hon. Member, on that occasion, call, d thewith unaffected defer ence to the decision of the House. I lion.",0.8679,212.78777249045135,22.3043265196256,21.679288649311964,21.779394728134207,20.822554075795868,21.129952943252757
729,1864,lib,"to56e. 6d. ; asd M. Leak, 475. M. te 4135. 641.Tics.-The public sales bare proseeded with mare spirit ;Imo *masa( said et M. lb. saesRms.-There is • fair eiry at .11.8, ram. CommasJamaica mid at Is 7d., sail at Is. 61. as la 144.RIM -A good bedews has bees seseasil, shied"" Brea%at 81. to Els. 3d. ; Itaagooe, 9s. ; and Balsas maser, to lair.De. to 10a.• ritcrtr.-Solders of currents hue abeam& tisk prierla. to 2w par eat., owlsg te the emommewneet of • samebowl rein fa Green, bet net emelt badmen Ma beertransacted.listrwerm.-200 bap of refosoldoe 7 sold et",0.4754,951.3577065398263,40.08419445403624,38.59140874218402,38.41717002096162,38.133048969658184,38.07271016893898
730,1802,lib,"Reynolds came back to him, andhe took him, and brought him to the watch-house.He had shoes on, but he wore them as slippers.—He could not get them on, for they did not fit him.The Witness having told the Constable his reasonfor apprehending this man-s.-the Constable havingsearched him, and found no money on him, he lethim go. As they were coming away. from thewatch-house; Reynolds said to the Witness, I be-lieve you are an honest watchman, and .I will giveyou a shilling to-morrow. - The Witness said,he wanted no treatment.' He afterwards metthe Bow Street Officers, who brotight the drawersto the",0.8557,18.58127193316914,4.1087999323609345,3.7793802510002723,3.680472790880596,3.794678485186464,3.8810174187317705
731,1849,lib,"opinion thatthe application of both parties in Upper and LowerCanada for compensation might be put into one Bill, thusrecognising the justice of giving indemnity to the one aswell as to the other; and observed that it appeared tohim that the Bill now under consideration for connpensa;ion for the rebellion losses in Lower Canada was but afulfilment of the instructions of Lord Stanley, in 1845,to Lord Metcalfe on the subject. As this Bill was,therefore, a Government measure, we were bound to itby every principle of justice and fairness, and it wouldbe a violation at public faith if they did not see",0.9484,69.74906679231228,5.398265584735513,5.388592452097652,5.456374162209537,5.175579413298393,5.171441151962839
732,1856,con,"is as thorough aRepealer. He was one, he says in his address, ""in1844, he is one in '56, ready to work in the causewits heart and hand; ready to aid in this greatmeasure, which comprises all other measures forthe prosperity, for the happiness, and for the gloryof Ireland!"" Several other candidates are alsospoken of. . .MR. BOWYER, M.P., has addressed a letter to Mr.James O'Connell with reference to certain ""unciviland illiberal remarks"" made by Mr. O'Connellwhen proposing Lord Castlerosse. Mr. Bowyerwrites :You boasted yourself a "" country gentleman,"" and, byway of contrast, sneered at ""a Mr. Bowyer, a lawyer,'among others.",0.957,36.52233510273831,5.683331670335491,5.867060532639676,5.86137709919737,5.797423679717191,5.776437596685126
733,1865,lib,"use of the me-chanically fitting bullets were abolished small-boreshooting would be greatly encouraged, the cost ofthe ammunition, in his opinion, operating as a barto that branch of practice.Mr. EDWARD Ross contended that the abolitionof the mechanically fitting bullet would not be at-tended with any good result, and the small-boreshooting, he thought, ought to be encouraged bymore prizes being given.Lord ELCHO, in reply, said that the question raisedby Captain Templer with respect to the exclusionof the great prize winners was a subject which wasworthy of reconsideration. As to the change in theback sight of the Enfield, it was to be rememberedthat",0.9745,42.793553502911756,5.4320580770782945,5.206238615679474,5.154975860736748,4.819164646094173,4.813566630346375
734,1820,rad,"it would be a manifesta-tion of the sense of the House, with which ij mightbe contended, that an address would be inconsistent.—(Hear, hear!)The question was put, and the gallery wa• orderedto be cleared for a division; hnt a division was notpressed f►r, and the proviso was negatived.Upon returning to the gallery we found the Housein a Committe on the Rill for punishing persons guiltyof privately stealing above the value of 3s.Sir .1. MACKINTOSII was addressing the Committee.He stated, that the Hill now before the Committee wasprecisely similar to those which had passed in 1810,1811, and 1813. Upon two of which",0.7683,88.42075132918214,6.938304907999871,6.819851607868337,6.841323061668309,6.1045671769147285,6.133042890476257
735,1854,lib,"the proprietors to judgeof their views and intentions. In the present dispute theboard has divided six against three. Do the proposedcandidates concur in the letters sent forth by the mi-nority ? Are they against the Lewisham and Bromleyproposed line? They say they are without information.The inquiry naturally suggests itself, have they takensteps by communication with the board or otherwise toacquire information? or upon what views do they ask thesupport of the proprietors ? Do they concur with the ma-jority of the present board, or is there to be a third partyin the board with different views from the other two",0.9755,80.33391174486609,5.705137596876129,5.531183973243035,5.496111735099217,5.89671810460172,5.858770714993108
736,1841,lib,"will introduce the popular Song of "" Wanted aGoverness !"" accompaniod by herself on the Pianoforte.To conclude with, a new Romance, 41 Three Acts, entitledTIM GALLEY SLAVES OF TOULON; OR, THEHIDDEN TREASURE!Louis de Valere, Mr. Osbaldiston ; Clauae Lapelle, Mr. E.F. Saville; Babin, Mr. Sanl ; Bouquet, Mr. Ross ; Antoine.Mr. Howard; Leonora, Miss Lee; Madame Bouquet, MissHoward, &c. &c.Boxes, 2s.—Pit, Is.—Gallery, 6d. Half-price at Half•pastEight.",0.9166,92.4533168604652,11.590372637825059,11.306667859073132,11.257639583521856,11.046060628230173,11.056971693499825
737,1844,lib,":s.Tottinghatn, and Ihave had the honour of battling by that gentleman'sside the enemies of the poor. No nian has ressted thePoor-law more vigorottFly or at greater sacrifice (4.time and money than Mr. IValter. It was thereforefelt necessary by Sir James Graham to get him outof the House of Commons, for Sir James was a manwho could not bear to hear the truth spoken,especially on that subject. A petition was presentedagainst Mr. Walter's return. They could only v:ovethat his friends—not his agents—had spent between 30/.1and 401. in money and what they called treating. TheCommittee was divided—three Whigs for throwing himout, three",0.9443,130.59859864221914,12.46955307332781,12.122067381356636,12.155166860553047,11.555463282897529,11.744514696233228
738,1852,con,"TAVERPOOT, BTANDATID, TITEBI).A_Y, OCTOBER 12, 18:,2.ber the men were taken before the magistrates, who told SUICIDE BY A PUNJAUB CAMPAIGNEIL—A. melancholythem that their wages were safe, and advised them to go act of suicide was committed on Wednesday night byto their work, and let the vessel proceed. They were John Ryan, a fine young fellow, who was at all the recentthreatened with imprisonment if they did not go on board. fights with our Indian army. He had once before attemptedgave them until the following morning to to commit suicidleaving the court the men surrounded Two of hisle, but was prevented",0.9127,198.0139000854791,31.790802462501706,33.02402405131004,33.01418359161248,31.45957187641531,31.880815157137974
739,1865,lib,"her Majesty's shipCumberland ; James Mutter, first-class assist.-en-gineer, to her Majesty's ship Thrasher; James J.Conway, first-class assist.-engineer, to her Majesty'sship Cumberland ; and J. W. Dupen, second-classassist.-engineer, to her Majesty's ship Adder. Therewere-. 31 candidates for examination.The following naval engineer students yesterdayreceived their examination tickets at Woolwich fromDr. Woodley, by order of the Board of Admiralty :—Mr. J. T. Trickett, Mr. J. WGarahan, Mr.Robert Madge, Mr. William Minn, Mr, WilliamGiles, Mr. Peter Baldwin, Mr. Thomas Parker, MrJohn Mather, Mr. William Hardee, Mr. WilliamNicholson, Mr. William Stewart, Mr. Thomas Hat-ton, Mr. Joseph Jefferies, and Mr. William Harris.The examinations were conducted with",0.9693,36.87432736341896,3.6376460206504815,3.7634881674546268,3.7431431235769383,3.5797044358927854,3.584958396444158
740,1864,lib,"congregationalmeetings as the Protestants had. (Hear, hear.). In reply to aquestion, Mr. King, the governor of the Preston House ofCorrection, said that he had had a few instances whereinRoman Catholics bad sent for priests; but those who requested their attendance had afterwards attended theministrations of the Protestant chaplain. Mr. G.Parker thought that if a prisoner once sent fora Roman Catholic priest, he was freed from at-tending the ministrations of the Protestant chaplain;and that, on the other hand, those who had notsent for a priest were compelled to attend —Mr. T. B.Addison—No compulsion is used. Any prisoner who hasa reasonable objection",0.945,58.072085093782256,4.018136022275477,3.9792600551900423,3.9777532836806677,3.8952032494295405,3.905347967781688
741,1865,lib,"been organised in Great Britain,the principal of which have been composed ofmembers of the Society of Friends. Sir ThomasFowell Buxton, Bart., is president, and SamuelGurney, Esq., M.P., treasurer of the LondonFreed Men's Aid Society, whose chief aim isto collect and transmit funds to the Americanorganisations. During the past week a move-ment for co-operation has been' commenced inParis, and private social meetings have been heldby the invitation of M. Daboulaye, in hischambers, Rue Taitbout ; Pasteur G. Monod, athis own house, and the Rev. T. Baron Hart, in theEnglish congregational chapel, Rue Royale. Adeputation from America and London has attended;Levi Coffin,",0.9748,61.57864109368233,5.592208408601056,5.328932288618321,5.335766964327884,5.252720449828651,5.285019043412831
742,1845,lib,"barouche and four, conveying her Royal Highness theDuchess of Kent, his Royal Highness Prince George, hisSerene Highness the Prince of Leiningen, and the Duchess ofBuecleuch.A barouche and four, conveying the Marchioness of Exeter,Lady Adeliza Manners, the Duke of Rutland, and the Masterof the Horse.A landau and four, conveying the Countess of Jersey, LadyClemcntina Villiers, the Lord in Waiting, the Marquis of.or-monde, and the Right Hon. Sir R. Peel.A landau and four, conveying Lady Peel, La Baronnede Finguerlin, M. Bard de Bretizel, and Lady Anna MariaDawson.A landau and four, conveying Lady Theresa Digby, theHon. Miss Liddell, and Mr. George Edward Anson.A",0.9561,19.616471959099243,3.0862126549442173,3.007713979660967,3.0106637608521596,3.0276201451464364,3.038251271342187
743,1861,lib,"there were any vegetablepoisons or medicines that might have been admin-istered to procure abortion, but found no trace ofany,Mr. Alfred Anderson, manufacturer, of Wilsden,one of 15 jurymen who sat upon the inquest, wasthen sworn and examined as a witness. He statedthat on the 3d inst., the day after the opening ofthe inquest, he wrote a note to a friend of his, Mr.James Field, surgeon, of Dudley-hill, near Brad-ford, and mentioned in the note that the disintermentof the body of Margaret Curtis had caused a greatsensation in Wilsden. He alluded to the medicalevidence which had been given, and in reply to",0.9613,28.701265708784945,4.634401152477117,4.616749387625642,4.569088866428027,4.484732173592067,4.548978539354985
744,1865,lib,"by 10 boilers, heated by 40 furnaces, whichwill consume on the average 100 tons of coal a day.The engines made from 48 to 50 revolutions aminute, with a vacuum of 26in., and a pressure of191 b. of steam. There was no inconvenience orstoppage of any kind, and no .indications of heatedbearings. The vibration, too, promises to be veryslight in proportion to her power. She answeredher helm admirably. She anchored in Holyheadharbou'r at 6.38 p.m., and would, It was understood,resume her voyage at 6 o'clock yesterday morning.Her internal fittings are now completed throughout,and the ,only additional work required is the raisingof",0.9733,63.18935206898509,6.462399266428597,6.072949082842773,6.124733545823592,5.926279737648428,5.9176036080520875
745,1831,none,"and Yni.sygwailod, Canuarthensbire, auctioneers.—Cmwther sad Dixon. Ou-ntersal, Yorkshire, manufacturing-chemists.—R. Shiers and S. Hall,Manchester, nonkeen-minufarturers.—R. and D. 11`Laughlin, Wigan,Lancashire, .""raper a. —Burton and hfrttya rather, Manehcster, wi... -merchantw—Jinkinson and Gibson, Sheffield, bricklayers.—Rend:and Mitchell, Kirkaldy, merchants.SCl)1'l:ll SEQUESTRATIONS.'SCOTT, ARTHUR, 0111•AOW,41}Cr, 41pril 8, 22, at Easton's 'raver s,Glasgow.BLACK, JAMS/ and JOHN, Ferenese and Glasgow, blete!.(rs, .% prd8.22, t the Lyceum-wills, Glasgow,• /0 • •1,4:_.v*.k 4•- 44.• A• 1 - 4lhr• . • • • AP7:41.hr?..11.96.4.41 47,naht-Colonel of to",0.8213,388.47720631021474,50.258602698691135,48.42310073832097,48.30707450887315,50.012462025831894,49.74762049094153
746,1818,rad,"1disputable &dew, HINTON. liisehad Peas pat in Iwo heedred Sir freecis Burdett. 1-16 .... lialithereh . 11.6 us -:rs or Ai tr.'Was his iblettgor I_ollVmol.sol4;riblelfee.,Ileasbess.althoegatheme Is a polities cal ante, that no Atli cad 'Kilt iliGlisith ittlaha *ether be Omni to Henry Beat, 1.16 __ . . ............. 6,g igWerfall lathe eleccites ego Colialseariaisdahoweate hail Esq. Airlitalmiheiltetroiertioes ha the People) caste k mad 1.4 .:.. •u. .. 11.191 • SOO katlye to the pprpoip. - 14.b1e..0tt *: .. be- 'more ace put is by alms empty-eve pewelfal toommsers 4we hope, astialthaamliag tbeesloandes of the Illieletaelel I*.i:...-**=ll.-''''. •••""-""'""- •""""''''''stign! • a",0.3721,892.7024737812543,151.23487835198335,145.8162822243251,146.57089709933067,148.55178933223985,149.30624991531113
747,1867,lib,"do. 18770.u.1c.13da.pay.1071011 Do-6.raachalmited100 aadrod guar. sp. oval100 Do. no. 41 d 0.....00 Do. do. 4i d 0...al Do. nth ltztonslor.Leib. and HO:AMD BR: IDo. 0 p. et., pay.lBteDo. p. et., pot. 100 t,INI./kotran e.lsto.BOndectßohllkund,e SpeDo. Shares do1)o. Nulbateeserbri:i grzes_Do. do. do._ 1Do. Punlanb do.Do. Indite St. nolo.Jour10 •4g;.148.ank (Lim.) • ...,.""100 liiii.Te;fii3ieW---!! +nslo Austr!so.. . 140 AajlefiFitlau (Lbs.)..20 Auglo Italian (Lulattsul).,40 Australasia . ...10 Bankol liritt;i6;juraida.10 Do. Now. bawd 1II Baal! of Egypt_11,0101010.010 11060,000 10NAN GOKO* 1030,000 llO 26110,000WOO 100400,001 10Bank of diaio (IlsoffA'Bankof Victorts,AomatBook of Now ZealandBrftlab N. America ....C. Bk. lrolls, Mao ChinaCwt. Mot. of IN* tflo.dated Baal!",0.5183,455.2011731335445,43.07205301437007,42.51906462254619,42.24578241109701,40.2858038661358,40.21871205060739
