,year,pol,sentences,ocr,loss_distilbert,loss_hmd_distilbert,loss_bnert-time-st-y,loss_bnert-time-y,loss_bnert-time-y_masked_25,loss_bnert-time-y_masked_75
260,1833,lib,"Francis Burdett and Sir RobertPeel on Irish questions. The support of the Tories injuredthem more in public estimation than it beßefited them onthe division. The effects of the suspicion tkuseengenderedin the public mind will not he easillOsoOn allayed.We have stated some or the reasons whic-E,l,kve`eaused usto view with distrust, and to scrutinize with adthe seve-rity the plans and apparent policy of a Cabinet whosemeasures we would gladly support and applaud. In carry-ing through every scheme of reform and retrenchment,which is worthy of the authors of the new Charter, weshall freely ands alously lend them our aid. During thesnuggle ou the",0.8869,199.29430235972376,17.341590488353173,16.99674135661961,16.6060882806153,16.82352935456489,16.882631342592607
261,1865,lib,"un-dertake what they must have known they could notperform.The members for the City of London also ad-dressed their constituents last evening, and en-deavoured to smooth the way for future contests.It must be confessed that none of the City membersdo much to distinguish themselves, but, taking allthings into consideration, those now sitting appearas good as any that we are likely to have. Mr.CRAWFORD spoke fairly enough on most of the chieftopics of interest which at present engross the atten-tion of the public. His speech was well received,as, indeed, were those of his colleagues. BaronROTIISCHILD was represented by his son, who saidvery",0.9797,89.94560623517701,4.3653604438588545,4.284575585503917,4.294134402541689,4.146988772764853,4.1678307699537624
262,1856,lib,"demi Wie. see ea Mk admen b-iome et heves el /re eueb gee amen eel be alleged.Ileelleweas ext Wren beedimei le We brokers el the Co..law=haam, eel Pewee M erl. ellon le Imam;Aim ail Sm. IS, Labbe. Wefts.gePlmemeebeee maw be belea es the Mew et the Gm.der Nudism NW Welbeeweire et Salmlbeee est reallee b Lemke. We libILeeweea~wwewWY. lairs mike =eisiirma.saicu.`-'l:llNek W Ilearbewee.TM Due Iblerd.feseeeetSub wpm* ti arcs eeo be rewired walls me et drIlsebeleaWeftwere, ale peed (Bo wr es We amberel awieepeled Ikr, le we plasma et Ile ea.elms ear milli weeW Wlllegles I. Or MO Si .111 DPWam",0.3279,1455.4176060957145,224.80269843076508,218.46353025878966,218.53917188099564,211.7117253098284,212.33004903022675
263,1830,lib,"andmuch-required Bill for the transfer of heritable bonds bysimple endoreation, by which he would confer very greatbenefit upon Scotland at large.—(Hear.)-14 also trusted'that his Hon. Friend (the Member for Stirlingshioz) wouldturn his great practical knowledge and acute mind to the ,truly important subject of seisios, with a view to theircomplete revision and reform; and that he would extenddill further the powers of that most valuable statute, thesmall Debt Act, for which he would deserve and receivelite gratitude of his country—(Hear, hear)—and he hoped'tees vigilant friend', the Umbels for Westbury and Aber-&era, would keep their chastening hands on that master-grievance the",0.8825,192.35381671568007,13.025178334462817,12.344905116894768,12.35219476704135,12.225119766746644,12.395219297820855
264,1840,lib,"them blas-pnenry. The interesting conversation was brought to aclose by the Right Rev. Prelate endeavouring topique the House of Lords against the Marquis ofNORMANBY,by declaringthat he never knewpublic justice so much outraged as bythe Marquis.The Pilots Bill was read a second time, after a fewwords from the Duke of WELLINGTON.The Clergy Reserves (Canada) Bill went through aCommit;,ee. Lord SEATON had no doubt that the 13111would be received with the greatest joy throughout theProvince, which joy. hoxever, the Bishop of EXETER.true to his character, sought to mar. He moved toexclude the Roman Catholics from all share of the Re-serves, and found",0.869,119.81264164572613,8.992943550637488,8.546182447732546,8.383586261805139,8.431666892460909,8.480057640498245
265,1848,lib,"wet weather has rendered the prospects ofour hop plantations much more gloomy in every respect.A cold ungenial spring is more to be dreaded in grow-ing hops than most other crops, and should this continuea few days longer, we expect to see it show its effects onthe Borough mat ket prices of this article, which are nowbelow the average of what they can be grown for. Theshouts the plants have made are stunted, and in mostcases will be pulled away as useless.—Maidstone Jeurnal",0.9232,84.68630298632951,6.917154087464756,6.94291344277543,6.986619271282413,6.555371475877528,6.619984894508566
266,1845,lib,"however agreedHwith the R;ght Hon. Baronet (Sir J. Graham) that itwould not do much harm. No provision was made forthe expenses wh'el would have to be defrayed ; and hecould not but think it a mere toy of legislation, whichthe Hon. Member for Hereford (Mr. Cowper) had beenamusing himself with that session ; and it would bemore respectful to the House if he were to withdraw it.Mr. DARBY referred to the circumstance of a ladywho had granted 500 allotmehts to her tenants, and whomade it a stipulation that whoever was taken before amagistrate should forfeit his allotment, and not one",0.9421,65.68175129523235,6.249382729428961,5.960263228501588,5.868734455012435,5.916257794333148,5.901871525724317
267,1863,lib,"as a vessel of war, she was sentto Buenos Ayres as a commercial adventure,contraband, indeed, but in no shape violating ourlaws or our national neutrality. If eaptured by aSpanish ship of war during the voyage she wouldhave been justly condemned as a good prize, andfor being engaged in a traffic prohibited by thelaw of nations. Bat there is nothing in our lawsor in the law of nations that forbids our citizens tosend armed vessels, as well as munitions of war, toforeign ports for sale. It is a commercial adven-ture which no nation is bound to prohibit, andwhich only exposes the",0.97,60.632481139420264,4.53110547226645,4.334503599736461,4.330522088243285,4.248673239497847,4.270638178026927
268,1854,lib,"with private property. He enter; going further, that it has been Colonel Garrett's custom 61 54 Do., Bury Extension. 1d - par st. 100 Do. 4.4p.c. Scrip.... 101 - 103 1021 the grand' tained as strong an aversion to assisting the Emperor' Prisoner-D;d you ever see me or speak to me in re--10 6 Gt.N. of Scot. let Pre' ... _... try for th,'of Russia in the war as any member of the house, but ference to the complaints I bad made ? to depute me, since I have been major in the regiment, 25 194 SNlewpwrtetstbeErgui.i&iikltfedn. 72 -..... 63.,,,i•",0.9463,293.23923823658896,25.21971639625338,26.05635712830703,25.754326404563386,25.553758426220302,25.753135211989857
269,1859,lib,"5 - - 41 1stock Do. do. B Stock 100 29 31 6UStock Eastern Union A Stock 100 44 46 _100 D0.41p.c. Bds. pay.'s9 all -generally is suspended, except for immediate 25 Do.Nw.A.(lte.E.U3ds) 81 - - 20 G eelong& Mel.gua.s p. e. all 18 2025 East Kent all 13 .15-wants. At Huddersfield there had only been a few Stock East Lancashire lOO 91 92 S°4 sto. c Geelong Corporation 6 ) 100 (per cent. Bondsbuyers in the market, chiefly for light fabrics ; 2OlO EastDo Suffolk all - -all - - Stock Grand Trunk of Canada 100 33 35 34100",0.7684,498.1830305572091,25.2830931563882,24.142402542725826,24.055861191857954,23.8005282334991,24.068499518050647
270,1860,neutr,"red sold at Ms; . :TEA.—Cothmon congous..' and flowery `Ain&have sold at a slight advance.Rum has sold at a slight advance. Demerara,1s; 11d. to 2s. ; Berbice, ls. 11d.Ricr.—Low to fine white Bengal sold at 9s.9d. to 14s. 6d. ; Baliam, 10s.PEPPER.—White has declined in value; Singa-pore sold 61d. to fild.SALTPETRE.—The market is firm.The LONDON TALLOW MARKET to-day wasquiet at the following prices :—Town tallow, Ms,net cash; Petersburg Y.C. on the spot, 53s ; Mayand June, 51s 6d; July to September, Ms; Octo-ber to December, 50s 6d.In the LONDON MINING MARKET to-day notmuch business has been done. Lady BerthaShares are",0.794,85.69898226784923,9.628636809696236,9.30377832768281,9.340673303952261,9.407338965398889,9.405704044763679
271,1867,lib,"er con, as tothe refereu's conduct; and as the other portions of thesporting press seem to differ iu opinion, the somewhat con-alerable experience I have had as to the duties of a refereemay, if appearing in your columns, tend to give the metera dearer aspect. To all your readers who are conversantwith boatracing and the champion course it will be atonce patent that, in crossing from the Point to the Soap-works, if the man with the Middlesex station bore the manon the Surrey side so far that the latter must either go out ofhis course or foul, in the event",0.9539,185.07723418948757,17.09161104423467,15.681597606049424,15.484212511127565,15.823158731406675,15.829169521075245
272,1831,lib,"Simmons, R.A., on presenting his work an Cot; s MartialLord Grimaton 'by the Earl of VernlamCapt. }lantotk: C.B. RN., by Sir James GrahamCapt. LOtlis, 1t.., on promotionMr. Grimston; by. Ldrd V.erttlarMr. Names, Gentleman of his Majesiy't Most Hon. Privy ChamberCapt. Barnard, Grenadcer Guards, fiy Si`r A. BarnardCapt. It. Logan, liy Lord I': Somerset .Capt. Hon. C. Berkeley, on prOrnotlon by Colonel PerkelevTown Major White, of the Gatrisdn of P,Town Col. IliggirsMajor Freeth, 64th Regiment, by Mr. Geifrge. HarrisonI,ieut. Stopford, by Admiral Sir R. StopfordHon. F. Byng, Gentleman Usher of his Majesty's Privy Chamber,on his appointment, by the Lord ChamberlainLieut. H.",0.8862,415.7967947322401,43.39959525771872,40.07005286048525,40.67953713921961,42.076737687492376,41.675412531414594
273,1861,lib,"We have no wish to interfere in this,family (panel. But the occasion seems to us good topoint out how inconvenient it is to speak openly beforemen who are in the habit of taking notes. .But while I am writing I get the evening'snumber of the Patric, which fully explains thereason for the silence of the press about its article.M. de la Guerronniere's organ, with a hardihoodwhich again proven that he draws his inspirationfrom sources super-ministerial, lets the cat out ofthe bag. The "" black man,"" of whom I, anirreverent foreigner not imbued with the "" fun-damental principles "" of the",0.8689,102.55436295343556,13.079266056606208,12.400865111810967,12.546596867766205,12.430424860524045,12.276555459880957
274,1858,lib,"THE PITMEN OP NOITHTIJDuse4r.NRWCABTLE-ON.TYNB, BATCHDLT NIGHT.A great meeting ot the pitmen of Northemberlandsad Brehm has Item bald upon the Black Pell to-day,about di miles from beers, eters they were addressed by Mr.R. P. Roberts. of Nesebeeter, the miners' attorney-general;Mr. 11PDessid, the aseettry to the Scotch Miners' dame's.ticat; Kr. Prep, of %Weed ; Mr. Smith Rradces, ofLeads, and several North-comatry delegates. The objectsought by calm the reesting woe to revive the pihosn'ssalon, a ogee knakekdecepisleatloa in the notlhamoonatim,to adhot an eerie.ingen ssioaget the mime of Bagsad Scotland, and procure from the nests a movie sadlegal contanat el service, ead to late",0.6331,419.18443607700044,72.93578463467037,67.82370687512943,67.92381096786576,65.27844065025266,64.98501246207393
275,1846,lib,"EASTCNKAP, LONDON.4,lllfaCtUrers of ftnd t'o., Merchants, Impor.!'eltars, have fo resale at this time oneinof thekill,.td,orn4%l,,hsst selected stocks of Cigars and Cherool-8 .iirtte,,,,k.l_o..lol,t, 178. Gd., las. 64., 205., and Ills. per lb. ,Fins11'1.sct Zt;;:e"",!48.1111148, 17s. 61. per lb. ; English made, from the~ Al. ; sil u IMl)orte.i cubas, Ts. • Havannahs,411)es; °las. 48. Gd.; lios Amigas, es. 6d. ; Recampurzas. 98. ;Cabanas,2. d.; cheroots, 68., 6s. Gd., and 71. per lb.VI...itint tits .2 LADIES TRAVELLING,....L Coast, or otherwise expoeed to the scorching rays ofUWr the sun, will find.-4 A.NI), Silt ltrepa SKA LYDOR a most refreshingm„,_ ea r,larxstic..a Srf the",0.7001,831.4774144899244,46.903198915490215,44.835124760798294,45.4104283232255,44.89978953748552,45.12692153250416
276,1851,lib,"in the pro-position submitted to you; it belongs to the Assembly. Thegovernment thinks that the constitution should he revised ;it unites in the wish which it considers as being that of theimmense majority in the assembly and in the country. Butuntil the moment arrives for the public discussion it thinksit its duty to act with great reserve. The bureau will,therefore, permit me to confine myself to this declaration ofmy opiniou without entering into further developments. Whathas been just stated by the hon. M. do Fallout obligesare, however, to reply. There aro hero three members ofthe cabinet funned by the President",0.9,96.71267235251638,7.136153034909663,6.83887929709896,6.958914791657077,6.681183956484853,6.669542708563565
277,1860,neutr,"MOiday,;:la.hudry 30-, 1860Rititth Stiats.ALRITISR AND NORTH AMERICAN ROYAL MAILSTEAMERS.earNOTICE.Ile Steamers for Halifax and Boston are intended to call atC°rk Harbour, on both Outward and Homeward passages, toeceire and laid Mails.Freight by the Mail Steamers to Halifax and Boston and to Newr' York direct, £3 per ton and 5 per cent. priipage.•- • ••Ight on Pamela Ss. each and upwards, according to size.dreels for different Consignees, collected and made up in singleheaddressed to one party for delivery in America, forLae. Purpose of evading the payment of freight, will, upon ex-Propel:""`""unation in America by the Customs, be charged with thefreight.The BRITISH AND",0.724,448.70608077803,28.338318976794653,27.968623644587147,27.769071698423964,26.711260051041698,26.881654448565097
278,1858,con,"would beich an earlier stage of hostilities we felt ourselves a wonderful and an eventful one. The new necessary to enter into the private chambersof the Popes themselves ; to read the livesre, scarcely justified in condemning. We would Indies were growing into America, Muscovy intoof such of their bastards as C.ESAR BORGIA,slysufferedentreat them to compare what we at firstwith what we have since inflicted. Russia; modern commerce was beginning its PIER-LUIGI FARNESE, or that ALESSANDROThat for of Genoa and Wiwi of whom II orra says, ""he makes itde in every British Christian foully massacred great carreer in the Republicsful",0.9186,354.9907632674969,86.36878020527593,84.93396118173449,86.35502589678609,75.85231912588068,76.61287506019241
279,1844,lib,"his advantageevery stride, passed the winning chair at least 20 lengths in ad-vance. The Returned headed Tom Tug at the distance, and beathim for second by about a length and a half. Caesar was sixlengths behind, and was placed fourth; Lather was fifth,Marengo and The Romp next, but all beaten off a long way.Most of the others were pulled up some distance from home.Charity fell after jumping the water, and Lather broke downnear the end. These, and Peter Simple's mistake at theditch, were the only casualties. We should state, in conclu-sion, that the ground run over was precisely the same",0.9644,77.94468977892775,12.755646243290125,12.903842792887755,12.930121424650796,12.563728001672096,12.673396148747038
280,1847,lib,"the cheapness of a vilemixture called Canadian whiskey, and partly to cli-mate, with a thermometer ranging to 120 degs. andwith such rapid alternations. In Canada, also, manreally conquers the earth by the sweat of his brow;for there is no harder labour than the preparation oftimber, and the subduing of a primeval forest in acountry of lakes and swamps. I have an instance ofthe effects of excessive.drinking daily before my door,in the person of a man of respectable family and ofexcellent talents, who, after habitually indulging him-self with, at last, the moderate quantum of sixtyglasses of spirits and water a day,",0.9629,64.98234761160893,9.855901770677274,9.48028304001862,9.338640283308331,8.852720910110575,8.83885002257096
281,1802,none,"who died in the Courfe of the hat Year. 'fhe orioinalDepartment of this Work will be fupported by feveral Writeraof Poetical Eminence.-Contributions and Notices for thenext Volume are requefted to be addreffed to the Editor, atMdr:S. Rivingtons.17. The HISTORY and ArTICTITIES of READINn. By theRev. Charles Coates, LL. B. Vicar of Ofminaton, and Paelton,in the County of Durfet, F. A. S. and Chaplain to Lit RoyalHighnefs the Prince of Wales. In a large Volume 4to. Prizain boards 11. tis.6d.18. ORIGINAL Forms, and TRANSLATIONS: particularlyAmiga*. From Lorenzo de Medai. Chiefly by SoraonitWatts. In t Volume livo. Price in Boards 4s.59. The",0.8055,192.94228261924053,11.554388868366239,11.046953449991356,10.951847854678249,10.498931989266042,10.42513217417313
282,1868,lib,"from the tire red hot and aimed a blow at his headwith it. He (complainant) put up his hands to save hishead when he wee burnt severely an both arms and hands.The landlady of the house, hearing his cries, came t. hisa.sistance, and before the poker could be wrenched fromhim her hands were much burnt.In answer to Mr. Barehaie,Witness said that be thought the priloner's mind hadbeen affected by the late elections, as he was quarrellingwith every one opposed to him.Mr. Bentham here observed that be bad remanded theprisoner, so that be weight be examined by a surgeon as tothe",0.7515,70.81357882478578,7.677006587309768,8.002088865127016,7.980351819678908,7.68613626151629,7.646947328578285
283,1866,lib,"-14 E PRUSSIAN ARMY.(From the Times' Military Correspondent.)ATTERBOGIC, June 9.Whoever casts a glance upon the map of CentralEurope must at once observe the range of moun-tains which, starting from the Black Forest, passesthrough Germany from west to east, separates thebasin of the Danube from the plain through whichthe Weser, the Elbe, and the Oder glide to the Ger-man and Baltic seas, and terminates in the chain ofthe Carpathian Hills. This range about midwaydivides into two branches near the source of theSaale, which again join together near the sources ofthe Weser, and enclose in the so-formed quadrila-teral the kingdom of Bohemia.",0.9802,75.46312763190618,5.552400179215676,5.61120994996015,5.604610370779214,5.2274988327953045,5.251203451571244
284,1866,lib,"as a faintlyakmakat medicine, and as a purifier of the blood, they are trulyfit; mild to their operation and grateful to the stomach,wr create appetite, promote digwtion, and strengthen theDerma =—Sold by W Lambert, chemist, 8, Xingwunrinstreet, -cross, and by most druggists, to boxes,ltd. and three times the quantity, In one, 2a M. Be rare to(ir Dr. Scott's Billow and Liver MIL The genuine are in aStem package, with ""Wiliam Immbert."" engraved on the3-MEM:VS COPAIIINE NEGE, the onlyhoseh Preparation adopted by the Parts Acadm andi—eeoe College of Surgeons ou the report of IleumLloyd, Poland and Legros Clark (.' lanoet,"" Roy.",0.6244,469.07449993612863,32.989626730389496,31.895967507260732,31.63083882599868,29.831468935151854,30.07772161083024
285,1857,lib,"limey ad of mostIf not ea Mg% hie Mr. Jen Soak, x.r.,busi la hid.and bee set bus In behind AIM tir middle of Jae; lwhen be went, or where be vent, I here no moose ofPram PETITIONS ro THE Flom or COMMONR.—The following rules moot be observed In the preparationand presentation of petitions to the Home of Cameos .Every member yemeathag • petition to the bare soma ea:balsams at the beginning thereof. Every petition mat bemates, and not printed or btholnpbod. Zany paillesmoat contain a mayor. Every petition most be aped by atlama one mesa on the skin or sheet",0.5326,944.4152098053586,103.65938918167235,97.96357052612227,98.4415758819607,99.72610543915408,99.48188685528235
286,1865,lib,"WESTMINSTER.MURDEROUS ASSAULT AND DAMAGE EY IRlSH.—JohannaGollagher, a decent-looking young woman, was chargedwith breaking a window sash and other property belong-ing to Mr. Sullivan.Mrs. Sullivan, of Union-place, Chelsea, said that onFriday afternoon, at four o'clock, she returned home andmet prisoner, her sister, and another woman, who wasbound over to keep the peace towards her. Prisoner cameinto her garden, using most horrible language, and, pick-ing up some enormous stones, as large nearly as her head,threw them at her. They broke in the panel of the door,smashed the window sashes in, broke several glasses, apicture, and other property. One of the stones struck",0.9829,95.39023797192479,7.022925631000502,6.650734829776715,6.604532192761933,6.509830551794049,6.527792496641174
287,1841,lib,"From the 3d of Augustnegotiations were prosecuted by Mr. Jackson, seeking forthe surrender of the Danish fleet for the security of thiscountry. Upon the 16th of August—a most importantdate—the Danish Government issued a proclamation,stating that the Danish Envoy had on the 13th declaredthat hostilities would commence, and therefore thatthe two countries were at war ; and thengave orders for the seizure and detention ofBritish property.. Now, as very much had beensaid on every occasion on the subject of want ofnotice of caution on the part of those in possession ofthe ships and goods which were ultimately seized by theDanish Government,",0.9645,47.68816010450219,4.286880759979731,4.292900899025109,4.3055464975620525,4.426175240686631,4.412572490013918
288,1860,neutr,",lAST YEAR'S PATTERNS, the best quality, Reduced from 20s. the Dress,. to 12s. 9d.AFRENCH MUSLIN ROBES Reduced from 295. Gd. to 18s. 541., warranted Fasteolours.LAST YEAR'S MOHAIRS, Light and Dark, Reduced from 18s. 6d. to 12s. 6d. the Dress.PATTERNS SENT FREE BY POST.J. CRIPPS, 14 AND 16, BOLD-STREET.GENERAL HOUSE' FURNISHING WAREHOUSE,TII E PALATINE ESTABLISHMENT,BOLD-STREET.ALARGE and well-assorted C K of CARPE T.S of the Newest and best Designs.FLOOR CLOTHS, BED AND WINDOW HANGINGS, BEDDING,BED-ROOM FURNITURE,Family and Table Linens, and all sorts of Upholstered):;ioods to meet the requirements of a general Family Trade.THE PALATINE ESTABLISHMENT,ADJOINING TII}: NEW crxn-iro ÜBE ,BOLD-S T R",0.6016,43.285934731686176,5.60221700218535,5.960141020530327,6.019014514019943,5.826256238788515,5.7938724790655405
289,1856,lib,"ask the question from a reportbeing current that the denial was couched in very am-biguous language.Lord PALMERSTON said he was unable then togive the hon, and gallant officer an answer from his nothaving had notice of the question.Sir DE LACY EVANS said he would repeat thequestion on Monday.APPELLATE JURISDICTION OF THEHOUSE OF LORDS.THE PROPOSED PORTRAIT GALLERY.The Marquis of BREADALBANE brought up herMajesty's answer to the address presented, by their lord-ships, praying her assent to the erection of a NationalPortrait Gallery. Her Majesty's answer was as follows :—""I have received your lordships' address, praying thatI may take into my consideration the",0.9424,112.96095162832391,5.390287933940655,5.078153881212772,5.036882976037041,4.469871376797159,4.49139047887474
290,1858,lib,"and which they effectually did ; how-ever, the fortress under his command took the Russian-by surprise that evening, and fired a salute in honour Mthe fall of Sebastopol at sundown. (Cheers and laughter.)Ile was sure that the Duke of Malakhoff would apprecia! tthe sentiment of the British army and navy in invitinghim to partake of the hospitalities of their table, andwho now united in drinking in all sincerity, success an,long life to the Duke of Malak huff. (Trernendomcheering.)The Duke of MALAKHOFF, on rising to acknowledgethe toast, was received with the most cordial andenthusiastic cheers, which lasted for several minutesHe said,",0.9319,102.51984414200892,12.050997356645027,11.009467125041532,11.134418691531666,11.11770693612511,11.23325745271754
291,1851,lib,"p.Manch., Sheffield, andLine., guar. shrs., No. 1 all 1034 11%Do. new, 101. .. • • all 12% 12%Do., 61. • • • • • • • • 3 % % PMidland Con. 6 p.c. stock 100 ••Do. Consel. Bristol &Binning., 6 per cent. • • 100 132 133Do. Bristol k Glouces. all ..Do., Leic. &8 per cent. guar. • 100 •• —• •Do., Preference • • • • 5 —•%dis.Norfolk Extension•• all 15 34i)o. guar. 534 per cent. all 4 —4sNorth British • • b 5Wor. &R' 01.1b1.6 p.c 8 % dis parshrews. 8& Blr., nee"" guar. all 10% 10Shrews.",0.7824,147.6829983063188,5.628089772105435,5.619569498281397,5.639475389789284,5.424256153437132,5.404060403409097
292,1805,lib,"Rear. Adniiral the Earl of Noirrussis,;. who, 'Stith hisusual enntizscebsion and good nature, honoured these per,:tornwncos with his presence.The Combined. r kerb, who, though superior to the Bri-tillt Blockading 'Flat. by eight Sail of the Line, remainedunder the- protedion of their batteries in disgraceful security.OPEIJVINGTHE GREAT AQUEDUCT OF PONTCYSyLTr,LLANGOLLEN YALE.[Cotnmunicated in a Private Letter.)The General Committee -of the Ellesmere CanalCompany having thought it right• that so very ex-traordinary and magnificent a work should be openedith some ceremony, intimation was given of theirintention ; and Tuesday, the 26th of November(being the day previous to the meeting of the half-yearly General Assembly)",0.7603,798.1973564638937,71.31424111670958,69.15969475663779,69.42902077550518,65.01315499399487,65.22408409966553
293,1849,lib,"same principle andscale of charge, maintained on the taxation. of the for-mer solicitors' bills, and that it is satisfactory to knowthat the large amount of costs incurred on the taxationand arbitrations referred to—viz., 5,4534 Is., has notbeen unproductive of benefit, the proceedings, so far asthey tire terminated, having resulted favourably to theinterests of the company, by eff cting deductions ifromvarious claims to -the extent of no less a sum than65,9551. 2s. 63.",0.882,133.301236552043,9.420502683774977,8.915009106648498,8.882044126417634,8.808270659524437,8.816832543677744
