,year,pol,sentences,ocr,loss_distilbert,loss_hmd_distilbert,loss_bnert-time-st-y,loss_bnert-time-y,loss_bnert-time-y_masked_25,loss_bnert-time-y_masked_75
0,1805,lib,"resume the coipmand, iuterti)s of the most gritifying'kind...,4Ott Sunday morning Capt. 4. of the ForfhrshireMilitia, and Dr. WA: of the 7d Regimeilcinatinthe I of, St; Fergns,. near Petprhead, to decideati atlitir of lionoar,' Upon aniving at the ground,however, the Seconds inteifered, anti the businesstvf“ amicably adjusted.' The 'quarrel originated inthe ball-Town the preceding evening.1-6 is atatiA in :the York Paper, fipon authority,ti) tt TifortNTorr, who rode the fitthouS'matchSature,ay.in the lag Augtiq isittietiug,di ;av her jockey ship on, thelast SatOrdity in thel'n)Uitril.Meeting, in alliatch for 3000 gs..tbur milerto gste—thr;-""Gentleman; 13st. •11,1 L ,N EIPS,.. , ,PLYMOUTH, AUG. 4.-There is no doubt,,",0.6016,941.2497371977129,103.24703744693855,98.17728019835855,97.98113606488171,99.5301890978814,99.03202164040273
1,1807,none,"failed from Portf-mouth on the 4th January, pallid that Bland on therBth : an uncommon quick paffage for a fleet of150 fail.Accounts were received in town nn Saturday fromthe River Plate as late as the 6th December. SeveralSpani(h officers had arrived iron) the interior atMonte Video, for the purpofe of organizing the inha-bitants and others difpored to arms. All the mercantilepeople have left off barriers, and turned their atten-tion to arms. A thong force was preparing to goagaina Maldonado. Their fume(' at Buenos Ayreshas had an aftonifhing effeEt upon the minds of theSpaniards; they confider themfelves the fink warriors;n the",0.8802,384.670030208571,22.76249447885758,22.371793811233914,21.734493823762286,21.096885711308968,21.226317922368914
2,1860,neutr,"Agents here untilSix o'clock on the Frulaypienings Pievioua to sailing.' Applyi in Halifax.; to Sir SaMuel Cunard, Bart, ; in Boston, toE. C. and I. G. Bates.; in NeW Turk, to Ed. Ctinard ; iii Havre,to Donald Currie, 21, Quai d' Orleans ; in Paris, to Donald Currie,12, Place de la Bourse; in London, to' J. B. Foord, 52, 91dBread-street; in Glasgow, to G. and J. Burns, l.""/ Buchanan-street ; in Queenstown, to D. and C. Mac Iver ' • or in Liver,pool to D. and C. MAC IVER. 8. Water-street.kW The PERSIA will start for NEW YORK, THIS DAY(Saturday),",0.8337,105.72561359623805,12.123737989338567,11.76847725338053,11.79840568357584,11.2999709797016,11.250293106309389
3,1816,con,"iu 4tinhops-street, Clare-market, where be had beewhis the babk if deal-ing for la years past.Mr. Boobbyer stated, that they had long suspestad thatthey were robbed, particularly since the month oflllay LW,Out could not detect the thief till the day the priiidelr wasstopped the act of robbing them, In the alt 4 'Re plinduced a lint of articles which filled a large sliest of papir„which he positively swore had been stoien from bla praises;particularly from part of the sbop-marks remainbps, and theynever selling them in that slate. He prodocectiticidier lbAlist, which lie very humanely declined sweating to aslis andpartner's property, although",0.8017,403.89787128506134,39.53115028430591,39.527041215022585,39.75409256259833,38.20291841568707,38.43529152170573
4,1861,lib,"average numberafter correction for increase of population is 325.In the last two weeks the deaths by bronchitis rose-froni 146 to ,217.; those by Pneumonik from 89 to95; those by phthisis from 136 to 171. Scarlatinawas fatal last week in 45 cases, 4 of which occurredin the west sub-district of Islington. Measles wasfatal in 49 cases, of which 4 occevred in the southsub-district of St. Giles, 3 in the Goswell-streetsub-district. There were 7 deaths from syphilis, 4from intemperance. 13 persons, of 12 were children,died by burns and scalds ; of these, two children, onethe son of a lamplighter, the other that",0.8554,53.37811228959345,6.709072675383464,6.74527544141436,6.642724153032233,6.451990606133332,6.489906210987387
5,1855,con,"~d~~~~L.......-- ✓ -~WRITING, BOOKKEEPING, &C.MESSRS. THOMPSON,No. 8, CLAYTON-SQUARE,Head Teachers in Liverpool a quarter of a century, guarantee toevery Pupil a good HANDWRITING in a few Lessons. BOOK-KEEPING by DOUBLE ENTRY, thoroughly and practicallytaught in a few days.Mrs. and Miss THOMPSON give Private Lessons to LADIES,or attend out, if required.Cards of Terms at 8, Clayton-square.D. WALKER, Importer of Leeches, hase• REMOVED from London-road to 28, ST. ANNE-STRKET.—A fresh supply from the Continent every week.HORATIO L E W I S,IMPORTER OF CIGARS,No. 67, CHURCH-STREET.li/- THE BEST BRANDS OF CIGARS IN STOCK.MEERSCHAUM BowLs and every description of SMOKINGAPPARATUS, of the most recent designs.PATRONISED",0.9158,73.19353027031853,8.432422786372628,8.201516659241365,8.19555878354254,7.873069031303398,7.9161303362942075
6,1869,lib,"the face, body, and limbs of the poor littlegirl (apparently but 6 mouths old) being spotted with sores,which emitted the most offensive smell. it was under-stood to be the impression of the doctor's assistant thatthe child was suffering from chicken-pox, in an aggra-vated form, but another medical man, to whom she (themother) had tak,:n the child, was of opinion that the childhad been poisoned by the vaccine matt T.Mr. Vaughan directed that Dr. Bennett should be sentfor, and a proper inquiry instituted as to the actual causeof the sad condition of the child, which must be plicedunder proper tic inoned;atoly.",0.9023,70.41957665775034,5.955959749790546,5.717365375013497,5.644219632218719,5.694275106000339,5.72751603354382
7,1862,lib,"re-sult you must have recourse to those means byWhich you create emulation in Peers of the realmand Members of Parliament, and large acred squiresand prosperous farmers ; you must appeal to thatspirit of emulation which is the author of all excel-lence in society. Entertaining these views, withthe permission of the society, I shall be most happyto give a prize for that purpose next year. (Cheers.)Gentlemen, there are one or two observations which1 should wish to make to you upon subjects con-nected with the condition of your class. In the firstplace, I rejoice that I can congratulate you upon agood harvest.",0.9591,59.715607028247625,5.060215435459806,4.8538414637615155,4.838967650681812,4.620729099776694,4.575579495896728
8,1844,lib,"PRICE OF SUGAR.The Average Price of Brown or Muscovado Sugar, for theweek ending July 9, 1844, is 335. Bd. per cwt., exclusiveof the Duties of Customs paid or payable thereon on the int-portation thereof into Great Britain.COURSE OF EXCH.Amsterdam CF. 12 5Ditto, at sight l2 3Rotterdam 2U. 12Antwerp 25 90Hamburgh M.B. 13 13Altona l3 13tParis, 3 days' sight 25 60Ditto, 3 months 25 85Marseilles 25 90Bourdeaux 25 90Frankfort on Maine l2lt.Petersburgh, 3Us 37Berlin 7Vienna, effec. fl. 3 M 953Trieste, dittoMadrid 37CadizBilbao 36Barcelona 36SevilleANGE.—(THIS DAY.)Gibraltar —Leghorn 3O 45Genoa 25 85Milan —Venice ........Naples 39Palermo, per oz llBLisbon 54Oporto 54Rio Janeiro 23Bahia 23Buenos",0.9528,186.2471626608472,4.1509851225698835,4.095660847557738,3.9832224981454227,3.8585468778736534,3.878864827321683
9,1860,neutr,"hand a number of'excellent Secoriaiff PIANO-FORTES and HARMONIUMS, for use . .AV . G . 'MADDY'S',.1 Physical ENGAGED for TWELVE NIGHTS, 'ilid will mak-e her First -a; Seti'.l fe„ a . ~.. -, . -.s ,aa * • •AT ' ' Li - . ' • ::-1':I:: R. S SAE. :TO I: :1 41.9'.'''--- --- . ' n .t.nc,i • .. - - , ,- ;„ • , equal to new, havinsubeen out on hire. only a short time. Pricery moderate.: , ''s ' - ' ' . NO. 25, BOLD-STREET.• •a -a.--Appearance in Liverpool on MONDA ', June 25.",0.8776,373.43333664615545,37.33291701051676,35.68779794073019,35.71683269616027,37.134547266614184,36.987595145910056
10,1856,con,"ASSASSINATION IN IRELAND.Mr. Thaddeus Callaghan, a respectable solicitor, of Dublinand Ballyronan, was assassinated near Portumna, on Friday.HOUSE OF LORDS.MONDAY.Their Lordships assembled at five o'clock.Lord BROUGHAM moved for copies of two letters from Pro-fessor Levi to the Statistic department, and their answerthereto. Agreed to. He then laid upon the table five reso-lutions with reference to the judicial statistics of this country,but he did not then ask the house to adopt those resolutions.The Commons Enclosure Bill passed through committee.The house adjourned at 6 40 p.m.HOUSE OF COMMONS.MONDAY.The house met at four o'clock.The second reading of the Imperial Hotel Company Bill,the object of",0.9721,35.663845668689746,4.021956418467173,3.9760892419911653,3.9757039094170934,3.8646887424073,3.877577728444429
11,1868,lib,"urgentin her selection of Dean Stanley for that see asshe had been for Canterbury. The result was, thatMr. Disraeli recommended a prelate who certainlyhad no claim to advancement, and whose promotionsatisfies scarcely anybody. The Guardian, a conspicuouslymoderate paper, is, on the whole, satisfied, but the ChurchNews says that the appointments will infallibly lead everyConservative clergyman to stand aloof at the elections. TheHigh Church clergy have had no consideration paid tothem, and no one can be surprised if they return Mr.Disraeli's compliment.The Hon. Colin Lindsay has denied that he has yetbeen received into the Church of Rome. I suspect thatthe denial",0.9749,81.61972813793253,8.56593501690944,8.34255762244055,8.167516545707374,7.720412740954796,7.687256011379691
12,1846,lib,"road with the near wheel of the waggon on his leg.Thimg inteamwas stopped immediately, and the decea,ed was removedfrom underthe waggon and conveyed to the Poplar station-house, where he wasexamined by a surgeon, who advised his immediate removal to thehospital. Ills right leg was lacerated and contused. The deceasedlingered till Friday, when he died from exhaustion. Verdict, ""Acci-dental death.""FIRE IN MILFORD•LANE STRAND.—Shortly beforenine o'clock on Monday morning a fire, attended:with serious damage,broke out in the stabling of Messrs. Soulsby and Co., coal-merchants,Milford-lane, Strand. Workmen had been employed in making anew cistern for the horses, and it is supposed that from",0.9234,75.827728053994,4.964031784392507,4.90136111062216,4.864023162673779,4.837238563691341,4.839260122417258
13,1825,lib,"damaged by fire to the extent of 100,0001.,in 1761 ; of an ingenious basket-maker construct-ing a scaffold of osiers, and bringing down theweather-cock of St. Alban's Abbey, 1786 ; andof the Emperors of Russia and Austria meetingat Troppau, in Bohemia, 1820.rlitt Day ARRIVALS IN TOWN.I,4lll(\ate •4311 t from Windsor. At the British Hotel—bordihtenif:°l4 Paris. At Kirkisam's Hotel—Mr. and Mrs.h..Nato:ln Oxfordshire ; the Rev. Mr. and Mrs. Ballard,ttp At Illivart's Hotel, Lower Brook-street—Lord1144 h 'q; r IlYnne, from the North ; R. Roden, Esq. and Mrs.t°l'l Bath, At the Royal Hotel—Captain SinchGrieve, Esq.In the late WAI: of the PENINSULA, the pea-santry",0.7173,145.83415268905037,15.803568776182528,15.790221104593174,15.602025735278602,14.879381225676855,14.82714719083196
14,1851,lib,"pro-ducing any effect. Soon after, hearing a cook crowI directed my steps towards the spot, and discovereda farm, the proprietor of which came to me. Wecarried my companion into his house, and then sentfor a medical man. During an hour and a half thefarmer and myself did everything in our power torestore animation, and when the doctor arrived he pro-nounced that all further attempts were useless.""—Galignani's .Messenger.THE MURDER AT FROME.FROME, TUESDAY.—AII efforts to apprehend theperpetrator of these atrocities have as yet failed. Thismorning the articles of wearing apparel stolen fromthe cottage were found in a field in the neighbour-hood.The inquest",0.9489,111.02394335384405,5.5905293865097745,5.596142986931123,5.5322562103580735,5.124617319598865,5.20968426303051
15,1847,lib,"an orderto examine the insolvent as a witness in the cause. TheIVice-Chaticellor refused to make such order, es being opposedto some eases, as "" Ewer v. Atkinene (2 Con) and "" Hewat-on v. Tookey"" (2 Dickens), which had for many years regu-lated the practice of the court in this raped, hitt he sug-gested to the parties to apply to the Lord Chancellor.Mr. J. Russell and Mr. Sidney Smith were now heed insupport of the application. They submitted that, as by thelate insolvent act (7 and 8 Vim.), all the insolvent's ableand interest passed to his &aliases, and as, therelbensigecould have",0.6209,119.7855074369688,10.157523423656146,10.045476854313542,10.082235779599982,10.449020735952951,10.381983172610179
16,1841,lib,"EXECUTION OP DARMES.Since the above was written, we have receivedby express, an account of the execution ofDARMES, at seven o'clock yesterday morning, atthe Barriere St. Jacques. He walked bare-footed, in his shirt, to the place of execution, hishead being covered with a piece of blackcrape, in conformity with his sentence. Therewere but few spectators, owing to the early hourat which it took place, and the almost moral cer-tainty on the part of the citizens of Paris thatthe KING would commute the capital punish-ment for imprisonment for life. DARMES wasescorted from the prison of the Luxembourg tothe foot of the guillotine",0.8991,44.051246993917594,3.2493628438055735,3.1407515192115145,3.1657538019055047,3.106522809768352,3.099869994102467
17,1853,lib,"IRE°L'RVATION OF LIFE FROM SHIPWRECK.Yesterday a meeting of the general committeeefofLthifee'l°f Al National Institution for the PreservationA-I.l7lo,l3Bhhiil3wcraepetkainwatsahmehldertatpetrhreettoffiincteßhs,eNeATh.oah,inn-strelvete,%80 observed present--Captain Davies,it,"" ' R. Hall, R.N. ; Mr. Edward Hurry, i,CCaamppttaaajieinnr~;-(Hardy, R.N. ; Captain Ommanney,-r.u.altner, Captain Washington, R.N. ; CRaptain. Ward,`'',l\i-, inspector of life-boats to the institution.read the minutes ofther previous 'meeting, the following rewards were or-ed to be granted :The suns of 4/. 10s. to several men for their praise-Worthy services to the crew of thee esdchaoonsheerrtNtaivinae--11130, of Guernsey, which was wrecked kThe men having, with*ll'° off the Isle of Wight.effect-. eunett's rocket apparatus, sutcrcaeneddeedd111 g a communication with thecrew Were,",0.7882,643.5569336138315,76.20251957504823,71.0870743701712,71.37292435630391,70.93791497494198,71.38429237118461
18,1854,con,"258 guns. During thestay of the squadron at Honolulu his Majesty of the Sand-wich Islands made an excursion on board the Virago, everyhonour ,being paid to him, salutes being fired, and the'yards manned. His Majesty announced his determinationof enforcing a strict neutrality during the present war.CHARLESTON, SEPT. B.—We are in the midst of a heavyN. E. gale, which has been bloWing for twelve hours with-out appearance of moderating. Extreme loss to the ricecrop must ensue from the excessive rise of the tides.Most of the rice plantations are necessarily overflown, andbeing in the midst of the harvest, a large portion of",0.9433,72.14062809499472,6.987556312774189,6.837609243170794,6.734997239433916,6.558214266397572,6.6394212743197745
19,1831,lib,"during the raging of thecholera on the Continent, ships were permitted to bring fromthence goods of all sorts, when, at this moment, ships conveyingcoals, a mineral, are prevented from proceeding by his Majesty'svessels of war.Mr. J. J. VI RIGHT, in moving the fifth resolution, ob-served, that he begged it to be distinctly understood that, 'in proposing the next resolution for the adoption of themeeting, he was very far from meaning to cast any reflec-tion on the professional character, or to impugn eitherexpressly or by inference the skill or knowledge of any ofthe medical gentlemen who composed the late MedicalBoard of",0.9243,87.54890334873491,7.280974105281262,6.896253534899712,6.830782061020692,6.645723658492947,6.709756525371252
20,1857,lib,"(I'..tic. 20,219.)GREAT HANDEL FESTIVAL AT THECRYSTAL PALACE. Under the especialpatronage of Her Majesty the QUEEN and H.R.H. PRINCEALBERT. Notice is given, that applications for tickets forplaces, reserved andnumbered as stated, are one guinea eachfor each performance, or at two guineas and a half for oneplace for the series of three performances, can now be re-ceived, and the places secured in numerical order, at theCrystal Palace, or by letter addressed to the Secretary there ;at the Temporary Offices of the Company, 79, Lombard-street; and at the Central Ticket Office, No. 2, Exeter-hall.The seats which are at present disposable consist of fourblocks",0.9625,30.03578566775989,3.1566921416718343,3.193646380807931,3.1538680924925635,3.126514867645802,3.1245464626424697
21,1860,lib,"10West India, California, Vene-yzuela, Chili, Peru, Grey-town, New Granada, Am. ../Maw —11-. yMay —,.yrISontkamp. ,1:11ay 14The Progres de Lyon contains the fol [towingnote :—"" M. de la Rochafoucauld, who has offer ed thePope 12 rifled cannon for his army, has asked permission ofthe Minister of War to purchase them in the ?renal]. arsenals. Marshal Randon has replied that it is imp ossiblefor him to grant the request, inasmuch as the Goyim .nmentneither gives nor sells cannon.""The Mysterious Power of the Mageet is most best .tifullydeveloped by Mr. F. M. HERRING, of 32, BasinghaJl. street,in his Patent Magnetic Brushes and Combs,",0.8561,219.6906668458982,22.83102650146312,21.773366939498324,21.8687189785899,20.94939416600374,20.952151435521955
22,1826,lib,"so profound and interesting. Amongthese worthies, we may class the writer of an article inthe Herald of this morning, upon the Corn Laws,which will be found in our last page. The writer verygravely says that "" the Corn Law question is a greathumbug ;"",and nobody who reads his article will doubtthe truth of the observation, for he has cooked up apretty kettle of fish out of the Corn Laws. He says thatimportation is a "" humbug,"" except it be subject at alltimes to a fair tax, about 12s. per quarter, which wouldbring the price up to about 605., and farmers",0.9269,46.84849204694024,5.829068430832002,5.597637517858169,5.569310888996374,5.405100265163589,5.368896846487981
23,1802,none,"It gives me great pleafure to find you fo fonunate in youraffairs, and to learn from you that you have fucceeded fo wellwith the Fie As& Cowpony. Indeed him* is due to your ta-lents and Induftry. I confider you one se Dawes lirturtis fa-vostrites, and if ever I am to be admitted into her Court,l thinkit will be through your vjcsaite mod isdredellias.""The letter to Mr. Newton, an Attorney of Stock-port, was then read. It cautioned him againftmortgaging or difpofing of Mr. Hatfield's Efiatain C hifiirty as the Plaintiff had fecurities upon them.Serjeant Coca s 1., in reply, laid, that",0.8808,156.80517636025715,24.0636338658506,23.926738863215043,23.9749054044601,22.32048242282635,22.356027171385264
24,1863,lib,"hon. gentleman had they not been preceded by aspeech which appears to me to have introduced to the con-sideration of the house principles so dangerous—(bear,hear)—l would even say so monstrous—(hear, hear)—thatthink it hardly becomes the house, after having heard suchan address from the Government, to allow the debate toclose in silence without attempting to obtain some evidencethat the opinions which have been advocated to-night bythe Chancellor of the Exchequer are at least shared by hiscolleagues, and especially by the First Minister of theCrown, (Hear, hear, and a laugh.) The speech of theright hon. gentleman was at once answered by my",0.984,70.86978865390533,4.581971740301822,4.561611662431604,4.512350958494858,4.547829592096509,4.553641286019099
25,1853,lib,";Hodgson, Birmingham.Michael Robinson, linen draper, Halifax, Dec. 16, andJan. 27 following, at eleven, at the Leeds District Court.Young, official assignee, Leeds ; Brierley, Halifax.Robert Walker, grocer, Stalybridge, Dec. 10 and Jan. 5,at twelve, at the Manchester District Court. Lee, Man-chester, official assignee ; Hampson and Sons, Manchester.Douglas Bradbury, builder, Derby, Dec. 9 and 30, atten, at the Birmingham District Court. Harris, officialassignee, Nottingham; Motteram and Knight, Birmingham.John Hodges and John Foster Hodges, hosier 4, NewBond-street, Nov. 28 at two, and Jan. 7 (and not Dec. 7,as previously advertised) at ore, at the Court of Bank-ruptcy. Nicholson, official assignee, Basinghall-street ;Depree",0.9555,24.786709397154006,3.7743614477419856,3.9248782024071383,4.014674829068531,3.9955974181898397,3.9903238371185323
26,1803,lib,"se the. l'nost, bratitiin I Specimensto oe me: within Creel; •In-rd will thegreatest variety *of ititijeCti illustrative of the Heathen My-•thology; and the VabulOtts History of the AnCients. •Those who ,have not learned to,study Gent; with criticalexactness, may, on viewing them in the dress. of painting, re,cognize a thousand bes.uties, feet. their curio...tidy theirtaste formed, and the it knowledge enlatzed. • .• •The Engraving.; will. be accompithq. with approp6ateexplanation, and in the course of the. Work a copious Preface'will be given A List of Subscribers will he printed,. • -Persons deskaus of early Impressions, are requested to send..in their names",0.7255,584.0920186103133,60.5187909379182,58.68874565873256,57.80592251661727,58.06233870508911,57.755695156904416
27,1845,lib,"HERRING FISHING.BERWICK, SEPT. 12.—This week a number of ourboats are laid aside for the season, and the landsmen areemployed in'the operations of the harvest. The fisher-men are still eager to get fish, and every night a fewboats have been out trying. Monday night one boat gottwelve crans ; Tuesday, highest take two crans ; andthis morning a few boats have from two toeight crafts. Prices are very high, eighteenshillings per cran, and the fish are good in quality.Next week the moonlight will be greatly in favour ofthe fishing. The weather is now all that the fishermencould want, and we believe",0.9533,54.07412173275123,8.299123462879377,8.158569767973672,8.1087766022613,8.102889960022392,8.056332632493648
28,1857,lib,"heard of factious combinations ; tee as they thought would effect a useful and prudentand if so, it was owing to the pressure of a combination extension of the county franchise ; and it was only whenthat the noble viscount acted in a manner which he de- on a close examination of the bill itself, it was found toeared to be inconsistent with the duty ho owed to the be so drafted as not to admit of those atnendments, anddignity of the Crown. I have, my lords, trespassed it was felt it would be a waste of the time of",0.9108,100.34583312521737,10.87608304226563,11.56477078972649,11.406731056676474,11.457697945316077,11.535605527077944
29,1855,lib,",Kirkhsm, on TUESDAY, thetwenty-first day of August, at Three o'clock in the afternoon. ineleven lots. They c unwise a very desirsbie farm called Pasture;Barn Farht, containing 382 acres and upwards, in a ring fence. Also,the well-accustomed Inn, and several Plots of Freehold Land, situate'in the townships of ltedlar-cum,Wesham and Warton, in the irrish,Kirkham, in the cotinty of ancaster. Also, a' desire, le FreeholdResidence at Poulton-on-the-Fylde, suitable fur a small: genteelfamily. Also, the Manor of Mach Urswick, or Westbte Lands, nearUlverston, in th Mineral District of Furness, in North Lancashire,together with certain Carriage Moneys or Rents, amounting to 2/2s 714 cl.",0.867,156.25992778661015,16.653865237677856,17.70090031094171,17.810593229478517,16.812358302160703,16.856785641955067
30,1861,lib,"7 per cent. Pref.... all - -• 25 Stockton & Darlington all 374 384 20 Sambre & Meuse ...... all 61 81existing primitive native means of conveyance by 25 Do , 13 74 84 p 10 Do. 54 per cent. Pref..... all 1s 1 s 95 5 6 p 20 San Paulo, lim, g. 7 p.c. 4bullock hackery being now totally inadequate to N l'i,3ft9V7aelew, 1860 lOO - - 20 S.Aust &Lomb Venetin 16 11 11 174the requirements of the trade of the coun- at Do Pref. No. 1 - - 26 Southern of France.... all 25 2620 S. East",0.7866,243.48484973323005,11.844515562734687,11.828717621086831,12.002126212115524,10.790724309934818,10.795961043351399
31,1863,lib,";partridges,oB Od to Os Od ; woodcocks, Os to Os Od ; snipes, Osto Os Od; teal, Os Od to Os Od ; wild ducks, Os Od to Os Od ;widgeons, Os Od to Os Od ; plovers, Os Od to Os Od each ;guinea fowls, Os Od to Os Od ; roasting pigs, Os Od to Os Odeach; Ostend fresh butter, 9d to Os lld ; English, lidto is 1d per lb ; English eggs, 7s Gd to 7s 6d ; French do.,4s Od to 6s Od per 100 ; leverets, 2s 6d to 3s 6d each.",0.8692,8.87721085990515,2.3490682209534737,2.3797718766676663,2.361773709460311,2.2410523672776823,2.246814532333094
32,1818,rad,"PRICE (W STOCKS THM. DAY AT ONE O'CLOCK.• Monk gtork 5 per Ceet. Navy 105113 per Cent. Ned. 'Wilt Haab 93 94 p -3T 7$ - - BliPek.ConAnl4 for A. ISM Long Ana.4 per Cent. Ezdalatr HUN 10 13 pTILE STATESMAN.- -LONDON:• 111VIIISIATe MANCH 12, 1818.•by the Shipping Intelligence tq-day we observe,with much satisfaction, that so losses hue been sus.taitteJ on the Leith coast.•The Indemnity Bill was fully discussed last nightIn the House of Commons, on the third reading.—The debate afforded ample scope for eloquence andnnergy in displaying the iniquity of the measureswhich have been pursued by a corrupt and",0.8483,777.8058745633132,76.11296718517109,75.86324301210507,73.41426475356023,74.50415620412086,75.77875049507422
